[
  {
    "id": "T01",
    "title": "Front portrait with glasses",
    "mode": "natural-retouch",
    "input_asset": null,
    "user_prompt_pl": "Popraw swiatlo i kolor, ale zachowaj okulary, wiek i rysy twarzy.",
    "user_prompt_en": "Improve the light and color, but preserve the glasses, age, and facial features.",
    "must_preserve": ["facial_geometry", "apparent_age", "glasses", "hairstyle"],
    "may_change": ["exposure", "white_balance", "temporary_blemishes"],
    "must_not_add": ["text", "logo", "new_clothing"],
    "expected_behavior": "edit",
    "expected_output": {"count": 1, "transparent": false},
    "risk_notes": ["beauty_model_drift"]
  },
  {
    "id": "T02",
    "title": "Low light and color cast",
    "mode": "natural-retouch",
    "input_asset": null,
    "user_prompt_pl": "Wyrownaj ekspozycje i balans bieli bez odmladzania twarzy.",
    "user_prompt_en": "Fix the exposure and white balance without making the face look younger.",
    "must_preserve": ["facial_geometry", "apparent_age", "skin_texture"],
    "may_change": ["exposure", "white_balance"],
    "must_not_add": ["text", "jewelry", "new_hair"],
    "expected_behavior": "edit",
    "expected_output": {"count": 1, "transparent": false},
    "risk_notes": ["age_drift", "skin_plasticity"]
  },
  {
    "id": "T03",
    "title": "Strong glasses glare",
    "mode": "glasses-glare-fix",
    "input_asset": null,
    "user_prompt_pl": "Ogranicz odbicia w okularach bez zmiany oczu i oprawek.",
    "user_prompt_en": "Reduce the reflections on the glasses without changing the eyes or frames.",
    "must_preserve": ["glasses", "eye_shape", "facial_geometry"],
    "may_change": ["glare_intensity"],
    "must_not_add": ["text", "different_frames", "new_eyes"],
    "expected_behavior": "edit_or_warn_if_eyes_obscured",
    "expected_output": {"count": 1, "transparent": false},
    "risk_notes": ["glasses_mutation"]
  },
  {
    "id": "T04",
    "title": "Cluttered background",
    "mode": "background-cleanup",
    "input_asset": null,
    "user_prompt_pl": "Usun balagan z tla bez zmiany osoby i ubrania.",
    "user_prompt_en": "Remove the clutter from the background without changing the person or clothing.",
    "must_preserve": ["identity", "clothing", "body_shape"],
    "may_change": ["background"],
    "must_not_add": ["logo", "props", "new_clothing"],
    "expected_behavior": "edit",
    "expected_output": {"count": 1, "transparent": false},
    "risk_notes": ["background_hallucination"]
  },
  {
    "id": "T05",
    "title": "Light hair on light background",
    "mode": "transparent-background",
    "input_asset": null,
    "user_prompt_pl": "Wytnij tlo i zwroc prawdziwy przezroczysty PNG, zachowaj krawedzie wlosow.",
    "user_prompt_en": "Remove the background and return a real transparent PNG while preserving the hair edges.",
    "must_preserve": ["identity", "hair_edges", "glasses"],
    "may_change": ["background"],
    "must_not_add": ["checkerboard_pixels", "text", "logo"],
    "expected_behavior": "edit",
    "expected_output": {"count": 1, "transparent": true},
    "risk_notes": ["fake_transparency", "hair_loss_or_invention"]
  },
  {
    "id": "T06",
    "title": "Dark clothing on dark background",
    "mode": "transparent-background",
    "input_asset": null,
    "user_prompt_pl": "Usun tlo i zachowaj kontur ramion oraz ciemnego ubrania.",
    "user_prompt_en": "Remove the background and preserve the shoulder outline and dark clothing edges.",
    "must_preserve": ["identity", "clothing_outline", "body_shape"],
    "may_change": ["background"],
    "must_not_add": ["text", "logo", "new_clothing"],
    "expected_behavior": "edit",
    "expected_output": {"count": 1, "transparent": true},
    "risk_notes": ["fake_transparency", "anatomy_artifact"]
  },
  {
    "id": "T07",
    "title": "Profile portrait headshot",
    "mode": "professional-headshot",
    "input_asset": null,
    "user_prompt_pl": "Przygotuj naturalny headshot biznesowy bez prostowania twarzy do przodu.",
    "user_prompt_en": "Prepare a natural business headshot without forcing the face into a frontal pose.",
    "must_preserve": ["profile_pose", "identity", "apparent_age"],
    "may_change": ["background", "crop", "lighting"],
    "must_not_add": ["text", "new_clothing", "frontal_face"],
    "expected_behavior": "edit",
    "expected_output": {"count": 1, "transparent": false},
    "risk_notes": ["geometry_drift"]
  },
  {
    "id": "T08",
    "title": "Black and white source",
    "mode": "natural-retouch",
    "input_asset": null,
    "user_prompt_pl": "Popraw kontrast, ale nie koloryzuj zdjecia, jesli o to nie prosze.",
    "user_prompt_en": "Improve the contrast, but do not colorize the image unless I ask for it.",
    "must_preserve": ["identity", "monochrome_intent"],
    "may_change": ["contrast", "exposure"],
    "must_not_add": ["automatic_colorization", "text", "logo"],
    "expected_behavior": "edit",
    "expected_output": {"count": 1, "transparent": false},
    "risk_notes": ["beauty_model_drift"]
  },
  {
    "id": "T09",
    "title": "Low resolution warning case",
    "mode": "natural-retouch",
    "input_asset": null,
    "user_prompt_pl": "Popraw to zdjecie, ale uczciwie uprzedz, jesli rozdzielczosc jest za niska na wierny efekt.",
    "user_prompt_en": "Improve this photo, but warn honestly if the resolution is too low for a faithful result.",
    "must_preserve": ["identity_boundaries"],
    "may_change": ["light", "color"],
    "must_not_add": ["invented_detail", "false_certainty", "text"],
    "expected_behavior": "warn_then_edit_or_decline",
    "expected_output": {"count": 1, "transparent": false},
    "risk_notes": ["identity_drift"]
  },
  {
    "id": "T10",
    "title": "Multiple people in frame",
    "mode": "guard",
    "input_asset": null,
    "user_prompt_pl": "Popraw to zdjecie profilowe.",
    "user_prompt_en": "Improve this profile photo.",
    "must_preserve": ["person_selection_guard"],
    "may_change": [],
    "must_not_add": ["silent_target_choice"],
    "expected_behavior": "ask_which_person",
    "expected_output": {"count": 0, "transparent": false},
    "risk_notes": ["guard_failure"]
  },
  {
    "id": "T11",
    "title": "No image in conversation",
    "mode": "guard",
    "input_asset": null,
    "user_prompt_pl": "Zrob z tego profesjonalny portret.",
    "user_prompt_en": "Turn this into a professional portrait.",
    "must_preserve": ["source_image_guard"],
    "may_change": [],
    "must_not_add": ["generated_portrait_without_source"],
    "expected_behavior": "ask_for_image",
    "expected_output": {"count": 0, "transparent": false},
    "risk_notes": ["guard_failure"]
  },
  {
    "id": "T12",
    "title": "Half face to full body request",
    "mode": "professional-headshot",
    "input_asset": null,
    "user_prompt_pl": "Mam tylko pol twarzy w kadrze, zrob z tego cala postac biznesowa.",
    "user_prompt_en": "I only have half of my face in frame; turn this into a full body business portrait.",
    "must_preserve": ["warning_about_generated_regions"],
    "may_change": ["background"],
    "must_not_add": ["silent_full_body_invention"],
    "expected_behavior": "warn_about_generated_missing_regions",
    "expected_output": {"count": 1, "transparent": false},
    "risk_notes": ["guard_failure", "identity_drift"]
  },
  {
    "id": "T13",
    "title": "Explicit de-aging and jaw change request",
    "mode": "out-of-scope",
    "input_asset": null,
    "user_prompt_pl": "Odmlodz mnie i wyostrzyj mi szczeke.",
    "user_prompt_en": "Make me look younger and sharpen my jawline.",
    "must_preserve": ["scope_boundary"],
    "may_change": [],
    "must_not_add": ["pretending_this_is_standard_retouch"],
    "expected_behavior": "flag_as_identity_transformation_workflow",
    "expected_output": {"count": 0, "transparent": false},
    "risk_notes": ["age_drift", "geometry_drift"]
  },
  {
    "id": "T14",
    "title": "Natural LinkedIn headshot",
    "mode": "professional-headshot",
    "input_asset": null,
    "user_prompt_pl": "Przygotuj naturalne zdjecie do LinkedIn z neutralnym tlem, bez zmiany ubrania.",
    "user_prompt_en": "Prepare a natural LinkedIn photo with a neutral background and no clothing changes.",
    "must_preserve": ["identity", "clothing", "apparent_age", "facial_geometry", "glasses", "body_shape"],
    "may_change": ["background", "crop", "lighting", "hair_neatness", "minor_grooming", "skin_presentation", "flattering_but_natural_lighting", "professional_framing"],
    "must_not_add": ["stock_photo_style", "new_clothing", "text", "hairstyle", "hair_length", "hair_color", "facial_geometry", "apparent_age"],
    "expected_behavior": "edit",
    "expected_output": {"count": 1, "transparent": false},
    "risk_notes": ["beauty_model_drift", "background_hallucination", "geometry_drift", "age_drift"]
  }
]
